{
    "id": "ubel-palmeiras-0",
    "character": "Ubel",
    "anime": "Frieren: Beyond Journey's End",
    "team": "Palmeiras",
    "sport": "Football",
    "year": 2024,
    "image": "images/football/palmeiras/ubel-palmeiras-0.jpg",
    "tags": ["football", "palmeiras", "ubel", "frieren-beyond-journeys-end"]
}