{
    "id": "toka-takanashi-ponte-preta-0",
    "character": "Toka Takanashi",
    "anime": "Love, Chunibyo & Other Delusions",
    "team": "Ponte Preta",
    "sport": "Football",
    "year": 2024,
    "image": "images/football/ponte-preta/toka-takanashi-ponte-preta-0.jpg",
    "tags": ["football", "ponte-preta", "toka-takanashi", "chunibyo", "love-chunibyo-other-delusions"]
}