{
    "id": "anya-forger-palmeiras-0",
    "character": "Anya Forger",
    "anime": "Spy x Family",
    "team": "Palmeiras",
    "sport": "Football",
    "year": 2024,
    "image": "images/football/palmeiras/anya-forger-palmeiras-0.jpg",
    "tags": ["football", "palmeiras", "spy-x-family", "anya-forger"]
}