{
    "id": "frieren-palmeiras-0",
    "character": "Frieren",
    "anime": "Frieren: Beyond Journey's End",
    "team": "Palmeiras",
    "sport": "Football",
    "year": 2024,
    "image": "images/football/palmeiras/frieren-palmeiras-0.jpg",
    "tags": ["football", "palmeiras", "frieren-beyond-journeys-end", "frieren"]
}