{
    "id": "chica-palmeiras-0",
    "character": "Chika",
    "anime": "Kaguya-sama: Love is War",
    "team": "Palmeiras",
    "sport": "Football",
    "year": 2024,
    "image": "images/football/palmeiras/chika-palmeiras-0.jpg",
    "tags": ["football", "palmeiras", "kaguya-sama-love-is-war", "chika"]
}