{
    "id": "darkness-palmeiras-0",
    "character": "Darkness",
    "anime": "Konosuba: God's Blessing on This Wonderful World!",
    "team": "Palmeiras",
    "sport": "Football",
    "year": 2024,
    "image": "images/football/palmeiras/darkness-palmeiras-0.jpg",
    "tags": ["football", "palmeiras", "konosuba", "darkness"]
}