{
    "id": "asa-mitaka-palmeiras-0",
    "character": "Asa Mitaka",
    "anime": "Chainsaw Man",
    "team": "Palmeiras",
    "sport": "Football",
    "year": 2024,
    "image": "images/football/palmeiras/asa-mitaka-palmeiras-0.jpg",
    "tags": ["football", "palmeiras", "chainsaw-man", "asa-mitaka"]
}