{
    "id": "aqua-palmeiras-0",
    "character": "Aqua",
    "anime": "KonoSuba: God's Blessing on This Wonderful World!",
    "team": "Palmeiras",
    "sport": "Football",
    "year": 2024,
    "image": "images/football/palmeiras/aqua-palmeiras-0.jpg",
    "tags": ["football", "palmeiras", "aqua", "konosuba"]
}