{
    "id": "nobara-palmeiras-0",
    "character": "Nobara Kuroiwa",
    "anime": "Jujutsu Kaisen",
    "team": "Palmeiras",
    "sport": "Football",
    "year": 2024,
    "image": "images/football/palmeiras/nobara-palmeiras-0.jpg",
    "tags": ["football", "palmeiras", "jujutsu-kaisen", "nobara-kuroiwa", "nobara"]
}