{
    "id": "nagatoro-guarani-0",
    "character": "Nagatoro",
    "anime": "Don't Toy With Me, Miss Nagatoro",
    "team": "Guarani",
    "sport": "Football",
    "year": 2024,
    "image": "images/football/guarani/nagatoro-guarani-0.jpg",
    "tags": ["football", "guarani", "nagatoro", "dont-toy-with-me-miss-nagatoro"]
}